{
  "version": 1,
  "kind": "receipt",
  "job": "processes",
  "attempt": "processes",
  "state": "failed",
  "parent": null,
  "usage": {
    "wallMs": 699.6421799995005,
    "tokens": null
  },
  "hashes": {
    "input": "dc51b8c96c2d745df3bd5590d990230a482fd247123599548e0632fdbf97fc22",
    "expected": "dc51b8c96c2d745df3bd5590d990230a482fd247123599548e0632fdbf97fc22"
  },
  "error": {
    "type": "worker_failed",
    "message": "worker_failed"
  }
}
