{
  "version": 1,
  "kind": "receipt",
  "job": "logs",
  "attempt": "logs",
  "state": "failed",
  "parent": null,
  "usage": {
    "wallMs": 621.6312940014177,
    "tokens": null
  },
  "hashes": {
    "input": "dc51b8c96c2d745df3bd5590d990230a482fd247123599548e0632fdbf97fc22",
    "expected": "dc51b8c96c2d745df3bd5590d990230a482fd247123599548e0632fdbf97fc22"
  },
  "error": {
    "type": "missing_output",
    "message": "missing_output"
  }
}
