{
  "version": 1,
  "kind": "receipt",
  "job": "terminal_receipt_fsynced",
  "attempt": "terminal_receipt_fsynced",
  "state": "passed",
  "parent": null,
  "usage": {
    "wallMs": 626.2548399972729,
    "tokens": null
  },
  "hashes": {
    "input": "c13208ac20f7d4ee70e2ae7e21553ee7523d3b78ac7928d67afcd2105ab03c83",
    "expected": "c13208ac20f7d4ee70e2ae7e21553ee7523d3b78ac7928d67afcd2105ab03c83",
    "artifact": "c13208ac20f7d4ee70e2ae7e21553ee7523d3b78ac7928d67afcd2105ab03c83"
  },
  "error": null
}
