{
  "version": 1,
  "kind": "receipt",
  "job": "output",
  "attempt": "output",
  "state": "passed",
  "parent": null,
  "usage": {
    "wallMs": 647.328084000037,
    "tokens": null
  },
  "hashes": {
    "input": "dc51b8c96c2d745df3bd5590d990230a482fd247123599548e0632fdbf97fc22",
    "expected": "dc51b8c96c2d745df3bd5590d990230a482fd247123599548e0632fdbf97fc22",
    "artifact": "dc51b8c96c2d745df3bd5590d990230a482fd247123599548e0632fdbf97fc22"
  },
  "error": null
}
