{
  "version": 1,
  "kind": "receipt",
  "job": "capture",
  "attempt": "capture",
  "state": "passed",
  "parent": null,
  "usage": {
    "wallMs": 660.5922800008557,
    "tokens": null
  },
  "hashes": {
    "input": "a9cff0709f9f8b7bb9a381ee3a5a88fdb7143565621d8f0fd83afd12f99c78e0",
    "expected": "0000000000000000000000000000000000000000000000000000000000000000"
  },
  "error": null
}
