{
  "version": 1,
  "kind": "receipt",
  "job": "one",
  "attempt": "duplicate",
  "state": "failed",
  "parent": null,
  "usage": {
    "wallMs": 640.3884760002256,
    "tokens": null
  },
  "hashes": {
    "input": "f1734a68232317c6dc71cbf33eb5858bf56b703bc1aafd29b7ba4cf893da3f70",
    "expected": "f1734a68232317c6dc71cbf33eb5858bf56b703bc1aafd29b7ba4cf893da3f70",
    "artifact": "f1734a68232317c6dc71cbf33eb5858bf56b703bc1aafd29b7ba4cf893da3f70"
  },
  "error": {
    "type": "duplicate_publication",
    "message": "duplicate_publication"
  }
}
