{
  "version": 1,
  "kind": "receipt",
  "job": "candidate",
  "attempt": "forged-success",
  "state": "failed",
  "parent": null,
  "usage": {
    "wallMs": 797.0198449984309,
    "tokens": null
  },
  "hashes": {
    "input": "10159baf262b43a92d95db59dae1f72c645127301661e0a3ce4e38b295a97c58",
    "expected": "10159baf262b43a92d95db59dae1f72c645127301661e0a3ce4e38b295a97c58"
  },
  "error": {
    "type": "validation_failed",
    "message": "validation_failed"
  }
}
